{
  "schemaVersion": 1,
  "kind": "genshinAcceptedVersionBaseline",
  "generator": {
    "name": "genshinVersionBaseline.cjs",
    "version": "genshinVersionBaseline/1"
  },
  "targetGameVersion": {
    "gameVersion": "6.7",
    "status": "strictlyBound",
    "sources": [
      {
        "sourceId": "genshinDb",
        "gameVersion": "6.7",
        "revision": "1bab2cdba4d218fd5caa46b5f54e7884ee8359a2"
      }
    ]
  },
  "sourceCatalogDigest": "e3281568020faca3bc635b1161993bbab27027fe574f6692d81f849d49509790",
  "datasets": {
    "characters.json": {
      "path": "games/genshin/data/characters.json",
      "digest": "5d239863352fc896931c0c626e2de1ad60c615e4e376142daa8e2d3a7464c211",
      "entities": {
        "10000002": "ab275c2449479d71143b7f17b419ddcbdf00db2fb8b39dbea76e4905d8f953f1",
        "10000003": "6ecfb119ee89d5ec31c1c907c24df0c189cb36a1251f56c7c95a6e70e8c95603",
        "10000005": "afb27f5e320457c73fdc9920c15f01f9ede0bb56547e5075faf957001e86ec62",
        "10000006": "d03b94c7f8f1862865e426be8be943ac7cec61142cdd31a60accd42b6e77375c",
        "10000007": "afb27f5e320457c73fdc9920c15f01f9ede0bb56547e5075faf957001e86ec62",
        "10000014": "03a7490448af2944694c9fccff6ffa3952dff964260da5de92561aa60a39c4a4",
        "10000015": "6caeb24964a634034e1d6b639791c7cb324b573ed69a6d244c09065d3d87be56",
        "10000016": "3f8f445e73c67a9620c5e8ef7933f84fcb2bfce3d8cb23c4ee33e7987c34c583",
        "10000020": "ddb6ef0f4846c1dad939e1e5fb9a5da7d0c2c7812a8e1d493d1a6e1b1ade2a1f",
        "10000021": "20dbab1d4027dc7fd6703281868346aee892dd2c3220fd983c7ef20bda930d8f",
        "10000022": "64189dbe842aafde346f15fe19cba05909751b5acbb224d47ab4908aeda94dbe",
        "10000023": "ec3a993f35f6a5e1b9f53cbed725c82da97da6aa43ee15ef587325236e742249",
        "10000024": "7e5d354ded315a6d5d82d19039e02a4020398e46c50a929315eec5549261dc22",
        "10000025": "535b3af6c92d2d31a725b4c56e824d8b0f961620b9ebb9695ef220133549affe",
        "10000026": "900dd8bfe8b688cf7f1889afc9fff630e755a489b93df0857ef2eb661521c40e",
        "10000027": "3e00c8a9b15a75b0fbda261d71b4d343473d376b6e2f0ca88ac5fec7baac48be",
        "10000029": "0fbd50998a01a923067401fdb802a8c2a9f154fdea18c593405feddf495a47fa",
        "10000030": "4d572fc435cd7d7df5f809e1b082eaf0f46c845e3ed2759ae90f46eb34484f8a",
        "10000031": "74ca7e60506ae74b123f433f31812005cb65ac58ea0e0b21387bcc7f5f88691c",
        "10000032": "74bb2d1c5a8b17c1fe5133aa2a22225b3b66f4b35a5447c1a585e9f4f25cc6af",
        "10000033": "db2d92fcc0c82af8749e9580ae13fa671438e2f84399938e4cb775a6ecbf2c1c",
        "10000034": "f45b5e6a8a423421d91ad4eda968178a55cc58f07af6fe75b54afe0d7b37c237",
        "10000035": "6683445bad43ba128744cdf8c940e2967d63b99d26fd239530be16fcc97f7e23",
        "10000036": "55f17fea7a83cd7fc310e028651cf4a87fa43e486797720a33b5cdc4bbfc1e90",
        "10000037": "7d5752b38e07c11057d7c72dc1284df0fabdb84f416ad5b013c9df6a25b814c6",
        "10000038": "c485ab826a23a076b5fc2430c8dc4cc41d83e6da48ae816f62fecb60934f25e9",
        "10000039": "aff438073925c0fa76332b51d94ee78719bdb6ab8f3d26c8ff922ad225b35093",
        "10000041": "e433caba4d117305a5e73ca7851e322e96bd6b2019ce08b9671dc90bceb8a23e",
        "10000042": "d72d2c3528d8c0de8f82aca4cc77d6c3235fae992cc3f19642ffa00716cb5ade",
        "10000043": "eef60a3877ce3e8fc215680683715617d1179e7860b4d7709834244cddc3d64a",
        "10000044": "336aef8bf74368f9300eb2f1698f69910f1e2903b333d47d9488303d1d232f5f",
        "10000045": "9c20eac376a9f4a50716989faa3bcfe641b92b82102ed8f36ed829a32c667d96",
        "10000046": "6e941045347becf7ae6548d66f9dc442a04892867949dcbe5f095275caee0685",
        "10000047": "91ec8c65e4c1a76922a6ac89910a59a903ff66693b9973752ec12d9d0d0a4246",
        "10000048": "97486e4543dc78f4b8339a25dc1eb5a271a6cf906d79a10fcd5e756298bc9495",
        "10000049": "fb4e678a6a778b73ef18d0498d420773b5171f9b4327b3de755d56f94456f7cc",
        "10000050": "f45636e1a87afbfa3a53f8652458b24b28d8ec5229bdefb9ae41a08248505104",
        "10000051": "2c269aaeb4b14164c93249e95fe5a28e2da38c56f903269a6e6f09b44d53f8ae",
        "10000052": "79e0a25451fd3cde64e9663cdee7a72c7b6c25c321c6c2ea21deea42dc4548af",
        "10000053": "f8ce35334a7e94ef7cbf56bca56dcfb592aae1dd78969f449e4327979d9255d7",
        "10000054": "dc0c472a6743d7ffed4c73dc3eef56315e5307f165dab6c7343ddea63a11c192",
        "10000055": "6b6339a06c1ee43ae2d177780f951dfeb6f26f3663367c2c5569a43cf70e8464",
        "10000056": "dfa09d640ba3f6bbf55477e20ad904093b362ea581d4c8437c3b9dd565f9aaa3",
        "10000057": "fab14b14f871a8f48d1aacb3b066f09daa77d34b3d7de9801b5b0348225014d9",
        "10000058": "35d49acb6b077c6edd30856c2d8230057710958206dc5c8f957302a4d0b0108d",
        "10000059": "f9eed36c0e4a4a7d5627e680d77b7fd0e3dac4824100fe4002b87c7beb79aad3",
        "10000060": "74affde99f136a62643ca1b99b5b86c8c7454436e481309b6c6006519f1c737e",
        "10000062": "bb3548425e0700449bbecf090f42d5dee5cb3d7ef1ff206c95a246d9571df95f",
        "10000063": "5d5a4dcedfdbdc0742cd43a604d9dc618c1b301093528947e81448e660e13a34",
        "10000064": "17a255d9875b6511ea972a3de3d389da38baa67c7ea8888ef7b170cf5e0327fe",
        "10000065": "b007eec53c4b470c94f350948869a2b22541bef6edb6fc32afb6c9777382c3f1",
        "10000066": "7de7265af133d426fc13c01382623dbb958e07b6eb27fa95460c9067d2e63fc9",
        "10000067": "29369fd65519cac6470e982ebef7673293f43e6471ae4f808b209dec437b5f9f",
        "10000068": "6141f8ab669fec98dac4f51c6244e74c5689ae38931d6cb004dd90840d1371e0",
        "10000069": "ee23ad967684d32364c408bfa89f8ff51a45e8923f81bb55a7bf275a8557e9f8",
        "10000070": "8bab83ebb5a27413aa2105765c53c1f017fdd6e789400fa599272ee679864a61",
        "10000071": "f0fc9a5b4a15b321db8c6a2e094136a039d04a0fe1d4638e04f0e931458774c6",
        "10000072": "692cf090ca87be47ce62f2dc8accdbc6af85d16a63ff657d3e711cca4ab21d96",
        "10000073": "707810869dbfa06cbe7be1f6dafca7bbc5c402aa902a7fc7103c35d90fb6f0ea",
        "10000074": "1f2b0c74c5cb7a8b7b8e27597759dd9a024b71a14b5230db19eed6f562ba5b53",
        "10000075": "bc4fd31596088fef48d6e4233e24750e6cd3f277dd074fafb1e5611dd3d30886",
        "10000076": "be0539e2d6ce08aa1bee455228f08cc01f4956c35c3e4b2b3fc99a9e1f75cd49",
        "10000077": "6d1f5d0606e1ccd07a219b84a7fde72e7c11bfe1a09f945af9e0bafb6bdb41a9",
        "10000078": "a6c47485df3de14fe765b80e39ab544debcaef4d4fb52455a4c9a93230d2a34a",
        "10000079": "452459f4b00569f42c8df5621ced1fae23a05eaaa5d36ecc5192b4bfdf6b1d68",
        "10000080": "fe4087b85c18e705d16ee76883ed3d5483342bad7c71bd8de74edb15d0e70785",
        "10000081": "832bd1c607f86869ef1450450b2b25b88676767ecfe829d0074756b1acd4d7c4",
        "10000082": "c40d83ed23324801bf6395a2f0c54734c0b07a6c2a98b7a4f9d9737d0d660b57",
        "10000083": "bca79ce09fddb4a1774e0432dfba353f267793c9ed5cff7f41b1caff7ea092b6",
        "10000084": "ca3ead8ae9f59e4955efd75546617fde2aec56b1786814935299518809344d4f",
        "10000085": "157475fc228b383a86330bbd1f406c5a31452ce6c758bc500b5a21a8d437d091",
        "10000086": "b4f362d065c00c4c0877511170c1d0c3a22f4ef16121f464081d69a7c5db924d",
        "10000087": "60029b045d2c852cf12846f8ae06b78aa1796fd2cfc9e6540b38a8bf88fe7541",
        "10000088": "dac1b000c95fb0cefb2e937a5370adaa9e6cbaf8ec2e9d0db6ec5a4a37afaea6",
        "10000089": "cbb1fcc1b4ae03568ccca51b84ba8b65f4d4c81f8c3ea575613db42de6675faa",
        "10000090": "17e145fe8d51a4f693fd51ca52dd51331c24f4329e46ffad42275b73e2eabf47",
        "10000091": "a88f2d5001a9f357d523d6d8ee08bc8ec930d970ba95624d699ade9ff3e3d014",
        "10000092": "9c53d038163d02c42fb83591c55bb4b77d235d1b9c3be2cb950befc8636b591e",
        "10000093": "e014d67d71b44514139b724a04bee3bf24eec436d8adcc3eaa52fbcb80d8b5ce",
        "10000094": "5b53bb053d924ef7d3a69c3525416b88c0d9898738ba8a31c694dff870718303",
        "10000095": "34921c0dedb395395a06f2b721b7fdcbcf059d7f1031569830ccd16c01339e3f",
        "10000096": "ba92e487be8c34974a90fce2fd425639cc87ec4a3b7e44a0266762c1d84bf507",
        "10000097": "695ad6315ef647197a369c48355ad10c821684b9efb0ee75d425b25e5927f2b9",
        "10000098": "c37a254c1ea539b62079322c5300309a9605f0bbf3ba4e3f1776943a0bb29c8d",
        "10000099": "66f42f62570c611752f9fb8188c9f466d8487e812fe4a039243b32c1822d056d",
        "10000100": "e8fefb417592aa5b2dc5af454de38ef3a1aadcda3edd3f92d9ec24006637ff5b",
        "10000101": "7f794ef178aa2f43a4e9c5ef562619b69a3ce085faa4f3205a6fdc31b5a2bac5",
        "10000102": "3597f1b8ac5988cfda28d46a0f21ba755be5ba41ece9ac58f5c9ceef31cae7ae",
        "10000103": "677174a498786f64ab91662fd85ade00b0fa74bf55326bf5a482daf22203c79e",
        "10000104": "4590a548b68ce2f6712d058afe03dd327c6ac388268224c69fe006a449c0575a",
        "10000105": "c02e94beadc67a4687e7b3324ed6e10f36d5fce630b818eef6d0a4524b380ed5",
        "10000106": "f21652531f3f5594f928ff55c8ca6b205b1fb13260352becefb4ae3028841d23",
        "10000107": "885c002452fa038ec4f5d777dfe396587d50ffaf0992e8e4a3e8366b8bc718ca",
        "10000108": "bb369e679c6c31a823a1909ab1da96618da9138e0c3b949b458fa887ed3aa6a0",
        "10000109": "8adb9e0b3daf8bff06819a8d0b5f45b84a913dd740f213abe0ed3b9219bebe4a",
        "10000110": "756b909858beabfe495ac5a40d4225fd83b878e1dbaf2ed2fb23d2670c6346ae",
        "10000111": "772c7a9ae5ca67612fa3f4620ee064077eb5811c8038d08652257ef250876e55",
        "10000112": "d8ae0d0a19cb1914e8f2216406afe36225d178a5abc46d4f5c02a187a8632d5c",
        "10000113": "8a81295bd3f365ca798354042ad3fbd6b2cb634c89dd59fd0bd799750a240c8a",
        "10000114": "5d248ce5aadffe0ce6c564e01bbc00772b008739301d42827bfe9521442bd04c",
        "10000115": "f56bc34612e9aa570ea5d984e85a9668b9b905baa5e0f9e85bbc4854d1fec974",
        "10000116": "407f15d1950799d16c8904aa6af6c0a2e5fcc520fbc381d28316dd6d3f80623d",
        "10000119": "7bcac6b03b499085fe756d40a4490d356592a7f3e2eba428259bda764939411d",
        "10000120": "832a88d1f67d5fd00e41dbf6172b614ae7a4ab43978aefccf86a8906041c3a07",
        "10000121": "71e12934432e3db38e665465545c0303d64fc8ac20ba423b5865428583b3d9d1",